{
  "schemaVersion": 1,
  "enabled": true,
  "allowImplicitInvocation": true,
  "intensity": "auto",
  "backend": "auto",
  "features": {
    "nestedSubagents": "auto",
    "agentTeams": false,
    "dynamicWorkflows": false
  },
  "limits": {
    "maxConcurrentSubagents": 6,
    "maxSubagentsPerObjective": 40,
    "maxLogicalDepth": 2,
    "maxWorkflowAgents": 12
  },
  "isolation": {
    "worktrees": true,
    "requireCheckpointForUncommittedDependencies": true
  }
}
